{
  "schema_version": "1.0",
  "submission_id": "assessment_1_student_4",
  "student_id": "student_4",
  "assessment_id": "assessment_1",
  "artifacts": [
    {
      "artifact_id": "artifact_001",
      "artifact_type": "lean_source",
      "source": {
        "filename": "38_Marks.lean",
        "format": "lean",
        "media_type": null,
        "path": "38_Marks.lean"
      },
      "content": {
        "raw_content": "\n-- Scenario 1: Advanced Course Eligibility Decision\n\n-- Declare propositional variables\nvariable (x1 x2 y1 y2 z : Prop) -- x1 and x2 are pre prerequisites, y1 and y2 are approval departments, z is condition to entry\nvariable (provable : Prop → Prop) -- The meta level prdicate takes the proposions to check provable.\n\n-- Given rules\n\nvariable (r1 : provable x1 → provable z) --If x1 is provable, then z is provable.\nvariable (r2 : provable x2 → provable z) --If x2 is provable, then z is provable.\nvariable (r3 : provable y1 → provable z) --If y1 is provable, then z is provable.\nvariable (r4 : provable y2 → provable z) --If y2 is provable, then z is provable.\nvariable (hx2 : provable x2)\n\n-- Rule to conculde eligibility z is provable\nexample : provable z := r2 hx2\n\n\n-- Test with another rule with the below assumption\n-- Assumptions\nvariable (ha : x1) -- Passing prerequisites x1\nvariable (hy1 : y1) -- explicitly from the primary department y1\nvariable (cond : C → y2) -- conditionally from a secondary committee\nvariable (rule : (x1 ∨ x2) ∧ (y1 ∨ y2) → z) --If passing least one of two prerequisites and\n-- conditionally from a secondary committee\n\nexample : z :=\n  rule (⟨(Or.inl ha : x1 ∨ x2), (Or.inl hy1 : y1 ∨ y2)⟩)\n\n-- Decalarion for Part 2\n-- Part 2 for for Example 1\nopaque conj : Prop -> Prop -> Prop\nopaque Provablerovable : Prop -> Prop\naxiom AxConjElimRight : ∀ x y, provable (conj x y) -> provable y\naxiom AxConjElimLeft : ∀ x y, provable (conj x y) -> provable x\naxiom AxConjIntro : ∀ x y, provable x -> provable y -> provable (conj x y)\naxiom AxPrTrue : provable True\naxiom AxNotPrFalse : provable False -> False\n-- To be re-visited\nexample : ∀ x, ¬ provable (conj x False) ∧ (provable x -> ¬ provable False) := sorry\n\n--======================================================================================\n--======================================================================================\n\n-- Scenario 2: Complex Transaction Verifi cation System\n-- Declare propositions\nvariable (a b c d : Prop)\n\n-- Assumptions\nvariable (ha : a)       -- a:The transaction originates from a device previously registered by the user.\nvariable (hb : b)       -- b:The transaction amount exceeds the user's typical spending pattern.\nvariable (hd : d)       -- d:The transaction has passed secondary biometric verifi cation.\nvariable (hnegc : ¬c)   -- c:The user's recent location history is consistent with the transaction's current location.\n\n-- Given Rule to apply\nvariable (rule : ((b → d) ∧ (¬a → (c ∧ d)) ∧ (a ∨ d) ∧ b ∧ ¬c) → (a ∧ d))\n-- Declare the example. Note, Unused variables can be ignored.\nexample\n  (a b c d : Prop) (ha : a) (hb : b) (hd : d) (hnegc : ¬c):\n  ((b → d) ∧ (¬a → (c ∧ d)) ∧ (a ∨ d) ∧ b ∧ ¬c) → (a ∧ d) := by\n\n  intro h\n  rcases h with ⟨h1, h2, h3, h4, h5⟩\n  exact And.intro ha hd\n\n-- Part 2 for for Example 2\n-- To be re-visited\nexample : ∀ x y, provable (conj x False) -> provable y := sorry\n\n--======================================================================================\n--======================================================================================\n\n\n--Scenario 3: Advanced Autonomous Vehicle Decision System\n-- Declare propositions\nvariable (A B C D: Prop)\n-- A: Heavy congestion is detected on the usual route.\n-- B: Weather conditions on the alternate route are unsafe.\n-- C: The car has enough fuel for the alternate route.\n-- D: The car successfully arrives at the destination.\nvariable (AlternateRoute UsualRoute : Prop)\n\n-- Declare the rules\nvariable (rule1 : A ∧ C ∧ ¬B → AlternateRoute) -- If heavy congestion is detected, the car can only reach the destination if the alternate route has safe weather (¬) and enough fuel\nvariable (rule2 : B ∧ ¬A → UsualRoute) -- If weather conditions are unsafe on the alternate route, the car must take the usual route, which requires no congestion (¬).\n\n-- Apply rules\nexample (ha : A) (hc : C) (hnb : ¬B) : AlternateRoute := by\n  apply rule1\n  exact ⟨ha, hc, hnb⟩\n\nexample (hb : B) (hna : ¬A) : UsualRoute := by\n  apply rule2\n  exact ⟨hb, hna⟩\n\n--Part 2 for Example 3\n-- To be re-visited\nexample : ∀ x y z, provable (conj x (conj y z)) -> provable (conj (conj y x) z) := sorry\n\n\n--======================================================================================\n--======================================================================================\n\n-- Scenario 4: An Advanced Cybersecurity System for threats\n-- An advanced AI cybersecurity system evaluates and responds to potential cyber threats based on propositional logic\n-- Declare propositions\nvariable (t r f m : Prop)\n-- t: A cybersecurity threat has been detected.\n-- r: An automatic response action (like isolating a system) is activated.\n-- f: The detected threat is confi rmed as a false positive after initial detection.\n-- m : Manual intervention by cybersecurity personnel is initiate\n\n-- Theorem to prove\n-- If a threat (t) is detected, the system must initiate an automatic response (r).\n-- If a threat is determined to be a false positive (f), automatic response actions must be immediately halted (¬r).\n-- Any automatic response (r) must be accompanied by a manual intervention follow-up (m).\n-- Either manual intervention (m) does not occur, or the threat is not a false positive (¬f), ensuring consistency in response.\nexample :\n  ((t → r) ∧ (f → ¬r) ∧ (r → m) ∧ (¬m ∨ ¬f) ∧ t) → (r ∧ m ∧ ¬f) := by\n  -- Assumption h for the above 5 facts. Note, n denotes negation.\n  intro h\n  rcases h with ⟨htr, hfrnr, hrm, nm_or_nf, ht⟩\n\n  -- derive r an automatic response action\n  have hr : r := htr ht\n\n  -- derive m manual intervention\n  have hm : m := hrm hr\n\n  -- Use (¬m ∨ ¬f) and known D to deduce ¬r\n  -- Since ¬m is false, only ¬r can be true\n  -- ¬m contradicts\n  have hnf : ¬f := by\n    cases nm_or_nf with\n    | inl hnm => contradiction\n    | inr hnf => exact hnf\n\n  -- Result\n  exact ⟨hr, hm, hnf⟩\n\n  --Part 2 for Example 4\n  -- To be re-visited\n  example : ¬ provable (conj x y)→ provable x  → ¬ provable y := sorry\n",
        "content_encoding": "utf-8"
      }
    }
  ]
}
